{
  "schemaVersion": 1,
  "sessionSetName": "069-automated-pull-critique-capabilities",
  "contractGate": "advisory",
  "command": ["python", "-m", "pytest", "-q", "ai_router/tests/test_floor_ratchet.py", "ai_router/tests/test_replacement_gate.py", "ai_router/tests/test_evidence_protocol.py"],
  "notes": "Light dogfood of the Set 068 contract-test floor on Set 069's own S1/S5 probes. The S5 ratchet/replacement-gate safety + integrity properties are deterministic and probeable; the meta-oracle residual (an authored probe could mint a false REPRODUCED, or a replay could validate the wrong entrypoint) is the non-probeable share reserved for the path-aware critique + the human-as-defense.",
  "defectClasses": [
    {
      "id": "DC1",
      "description": "The ratchet auto-merges a candidate falsifier into the floor without all mechanical gates passing AND explicit human approval (the never-auto-merge / rubber-stamp safety property).",
      "probeable": true,
      "coveredBy": [
        "test_admitted_when_gates_pass_and_approved",
        "test_pending_when_gates_pass_but_no_signoff",
        "test_rubber_stamp_guard_approval_cannot_override_failing_gate"
      ]
    },
    {
      "id": "DC2",
      "description": "Mandatory floor-ratchet coverage is under-enforced -- a reproduced probeable defect is marked covered without its own stable-ref candidate (the S6 dogfood Major: a free-text description match).",
      "probeable": true,
      "coveredBy": ["test_description_keyed_candidate_does_not_cover"]
    },
    {
      "id": "DC3",
      "description": "The replacement gate reports meets_thresholds=True on an underpowered benchmark (manual run wrongly relaxed on too few real cases).",
      "probeable": true,
      "coveredBy": ["test_underpowered_forces_not_met"]
    },
    {
      "id": "DC4",
      "description": "The scoreboard schema/validator accepts a smuggled verdict/meets/cadence field, letting a hand-asserted verdict bypass the derived score.",
      "probeable": true,
      "coveredBy": ["test_scoreboard_rejects_smuggled_verdict_field"]
    },
    {
      "id": "DC5",
      "description": "The meta-oracle residual: a model-authored probe mints a false REPRODUCED, or a replay runs yet validates the wrong public entrypoint. No single deterministic assertion expresses this -- it is reserved for the path-aware critique + the human as the meta-oracle defense.",
      "probeable": false,
      "coveredBy": []
    }
  ]
}
