{
  "schemaVersion": 1,
  "sessionSetName": "068-cadence-study-and-contract-gate",
  "contractGate": "required",
  "command": ["python", "-m", "pytest", "-q", "tests/contract"],
  "notes": "Example contract manifest. DC1/DC2 are probeable (deterministic contract tests carry them); DC3 is the non-probeable residual reserved for the path-aware critique.",
  "defectClasses": [
    {
      "id": "DC1",
      "description": "The close-out gate accepts a floor result from a different session set (stale/copied artifact).",
      "probeable": true,
      "coveredBy": ["test_floor_set_name_mismatch_fails"]
    },
    {
      "id": "DC2",
      "description": "A probeable defect class with no covering contract test silently passes the gate.",
      "probeable": true,
      "coveredBy": ["test_uncovered_probeable_fails"]
    },
    {
      "id": "DC3",
      "description": "A subtle cross-file coupling regression whose failure mode no single deterministic assertion can express.",
      "probeable": false,
      "coveredBy": []
    }
  ]
}
